{
  "version": "1.0",
  "artifact_type": "challenge_review",
  "artifact_id": "challenge-task-001",
  "producer_type": "challenger",
  "task_id": "task-001",
  "reviewer_type": "challenger",
  "concerns": [
    {
      "severity": "blocking",
      "description": "The auth token refresh logic has no retry mechanism — if the refresh endpoint is temporarily unavailable, users will be logged out",
      "category": "structural_risk"
    },
    {
      "severity": "non_blocking",
      "description": "Error messages expose internal service names which could aid targeted attacks",
      "category": "security_concern"
    }
  ],
  "blocking": true,
  "summary": "Auth token refresh lacks resilience and error messages leak internal topology. The refresh issue is blocking — a single failed refresh should not force re-authentication.",
  "memory_suggestions": [
    "This project's auth flow is sensitive — always check token refresh resilience when auth changes are made"
  ],
  "created_at": "2026-04-05T14:30:00Z"
}
